{
  "id": "urai-runtime-spatial-proof",
  "slug": "urai-runtime-spatial-proof",
  "title": "URAI Runtime Spatial Proof",
  "description": "Synthetic system manifest used to validate the asset factory true 3D runtime contract.",
  "assetType": "model-glb",
  "symbolicCategory": "orb",
  "visualLayer": "spatial-field",
  "environment": "home-world",
  "geometryType": "mesh",
  "glbUrl": "system-assets/runtime-proof/1.0.0/orb.glb",
  "thumbnailUrl": "asset-previews/runtime-proof/1.0.0/orb.webp",
  "previewUrl": "asset-previews/runtime-proof/1.0.0/orb.webp",
  "fallbackAsset": "system-assets/fallbacks/1.0.0/orb-fallback.glb",
  "version": "1.0.0",
  "status": "approved",
  "visibility": "system",
  "permissions": {
    "publicReadable": false,
    "adminOnly": false,
    "containsUserData": false,
    "sanitizedForDemo": true
  },
  "createdBy": "system",
  "createdAt": "2026-06-05T00:00:00.000Z",
  "updatedAt": "2026-06-05T00:00:00.000Z",
  "tags": ["runtime-proof", "spatial", "orb"],
  "dependencies": [],
  "compatibleScenes": ["home-world"],
  "performanceTier": "mobile-mid",
  "mobileReady": true,
  "arReady": false,
  "vrReady": false,
  "xrReady": false,
  "spatialReady": true,
  "productionReady": true,
  "validation": {
    "schemaValid": true,
    "filesExist": true,
    "urlsReachable": true,
    "gltfValid": true,
    "noPlaceholderText": true,
    "noDebugText": true,
    "noPrivateData": true,
    "checkedAt": "2026-06-05T00:00:00.000Z",
    "errors": [],
    "warnings": []
  }
}
